
================================================================================

PROGRAM INFORMATION

   code:                Truchas
   version:             3.1.0-alpha
   build architecture:  x86_64
   build date/time:     2019-08-26 08:37:27
   build flags:         -u -C -C=dangling -gline -nan
   build host:          noether.lanl.gov
   run architecture:    Linux noether.lanl.gov 4.13.16-1
   run host:            noether.lanl.gov1 SMP Mon Nov 27
   run date/time:       26 Aug 19 15:23:52
   processors:          1

================================================================================

COPYRIGHT

   Copyright 2007-2019.  Triad National Security, LLC.  All rights reserved.

   This program was produced under U.S. Government contract 89233218CNA000001
   for Los Alamos National Laboratory (LANL), which is operated by Triad
   National Security, LLC for the U.S. Department of Energy/National Nuclear
   Security Administration.

   Truchas is open source software distributed under the 3-Clause BSD License.

================================================================================

INPUT

Opening input file ./broken-dam.inp ...

Reading FUNCTION namelists ...

Reading VFUNCTION namelists ...

Reading TOOLPATH namelists ...

Reading PHASE namelists ...
  Reading PHASE namelist #1
  Reading PHASE namelist #2

Reading MATERIAL_SYSTEM namelists ...
  Reading MATERIAL_SYSTEM namelist #1
    using default REFERENCE_TEMP =  0.000E+00
    using default REFERENCE_ENTHALPY =  0.000E+00
  Reading MATERIAL_SYSTEM namelist #2
    using default REFERENCE_TEMP =  0.000E+00
    using default REFERENCE_ENTHALPY =  0.000E+00

Reading PHYSICS namelist ...

 Reading OUTPUTS Namelist ...

Reading MESH Namelist ...
  MESH_FILE not specified; using inputs for an internally generated mesh

 Reading MATERIAL Namelist # 1 ...

 Reading MATERIAL Namelist # 2 ...
This is the last MATERIAL Namelist.
Identified 2 material(s)

               Material Priorities

         Material     Name     Priority
         --------     ----     --------
             1        water        1
             2          air        2

 Reading LINEAR_SOLVER Namelist(s) ...
Warning: LINEAR_SOLVER namelist not found! Using defaults.

Reading NONLINEAR_SOLVER Namelists ...
  NONLINEAR_SOLVER namelist not found; using defaults.

Reading INTERFACES namelist ...

 Reading BODY Namelist # 1 ...

                                   Geometry Data

          Body  Material  Surface  Translation  Rotation  Rotation  Surface
                 Number     Type      Point       Point     Angle  Parameters
          ----  --------  -------  -----------  --------  -------- ----------
            1       1    box        2.857E-02   0.000E+00    0.0    5.715E-02
                         (inside )  5.715E-02   0.000E+00    0.0    1.143E-01
                                    2.857E-03   0.000E+00    0.0    5.715E-03

 Reading BODY Namelist # 2 ...
            2       2    background
         BODY Namelist number  2 will be used for background material ( 2)

Reading NUMERICS namelist ...

Reading FLOW namelist ...

Reading FLOW_BC namelists ...

Reading FLOW_PRESSURE_SOLVER namelist ...

 Reading BC Namelists ...
BC namelists not found; using defaults.

Reading PROBE namelists ...
  no PROBE namelists found

Input file ./broken-dam.inp closed.

================================================================================

INITIALIZATION


Initializing mesh "MAIN" ...
  generating an internal ExodusII mesh
  finding cell neighbors
  partitioning the mesh cells
  partitioning the mesh nodes
  numbering the mesh faces
  partitioning the mesh faces
  identifying off-process ghost cells
  generating parallel mesh structure
  UNSTR_MESH Profile:
     PE|    nnode    nface    ncell
    ---+---------------------------
      1|     4386     8492     2100
  Mesh Communication Profile:
              Nodes           Faces           Cells
     PE|  off-PE   on-PE  off-PE   on-PE  off-PE   on-PE
    ---+------------------------------------------------
      1|      0     4386      0     8492      0     2100
  Mesh "MAIN" initialized

Allocating base derived types A ...done.

Computing initial volume fractions ...
ERROR: material 2 volume fraction > 1 in cells: 21 22 23 24 25 [851 more items omitted]
       maximum volume fraction less 1:  1.05871E-12
  Computed volume fractions are invalid; attempting to normalize.
  Normalization was successful.
  Initial volume fractions computed.
  Using default value "specific heat" = 0.000E+00 for phase "water"
  Using default value "specific heat" = 0.000E+00 for phase "air"
 Initializing Displacement Boundary Conditions

 Locating cell faces for which BCs are to be applied ...
 Initializing Pressure Boundary Conditions
   DIRICHLET: 0 boundary points
   REFLECTIVE: 4384 boundary points
   EXTERIOR: 4384 boundary points
   NEUMANN: 0 boundary points
   HNEUMANN: 4384 boundary points
 Pressure BCs initialized.

 Finished BC initialization.

Configuring volume tracking ...
Generating velocity boundary condition for "velocity" type
Generating velocity boundary condition for "no-slip" type
Generating pressure boundary condition for "pressure" type
  using FLOW_BC[right]
  using FLOW_BC[top]
Generating pressure boundary condition for "pressure" type
  using FLOW_BC[right]
  using FLOW_BC[top]
Generating pressure boundary condition for "velocity" type
Generating pressure boundary condition for "no-slip" type
Generating pressure boundary condition for "free-slip" type
  using FLOW_BC[rest]
Generating pressure boundary condition for "marangoni" type
Generating velocity boundary condition for "free-slip" type
  using FLOW_BC[rest]
Generating velocity boundary condition for "marangoni" type
projection solve:    2 (DS),   10 (AMG), 3.9003E-11 (|r|/|b|)
Initializing solution probes ...

================================================================================

EXECUTION


          1: t =   0.00000E+00, dt(initial) =   1.00000E-03
projection solve:   18 (DS),    9 (AMG), 9.1881E-11 (|r|/|b|)

            Min Velocity: (-2.6366E-03, -9.7577E-03,  0.0000E+00)
            Max Velocity: ( 2.9449E-02,  6.9877E-03,  0.0000E+00)

          2: t =   1.00000E-03, dt(growth) =   1.05000E-03
projection solve:    4 (DS),   10 (AMG), 3.4442E-11 (|r|/|b|)

            Min Velocity: (-5.1667E-03, -2.0051E-02,  0.0000E+00)
            Max Velocity: ( 6.1655E-02,  1.5966E-02,  0.0000E+00)

          3: t =   2.05000E-03, dt(growth) =   1.10250E-03
projection solve:    3 (DS),   10 (AMG), 1.1887E-11 (|r|/|b|)

            Min Velocity: (-7.5715E-03, -3.0873E-02,  0.0000E+00)
            Max Velocity: ( 9.5698E-02,  2.5700E-02,  0.0000E+00)

          4: t =   3.15250E-03, dt(growth) =   1.15763E-03
projection solve:   28 (DS),    8 (AMG), 9.4340E-11 (|r|/|b|)

            Min Velocity: (-9.8751E-03, -4.2206E-02,  0.0000E+00)
            Max Velocity: ( 1.3127E-01,  3.4554E-02,  0.0000E+00)

          5: t =   4.31013E-03, dt(growth) =   1.21551E-03
projection solve:   29 (DS),    8 (AMG), 4.4737E-11 (|r|/|b|)

            Min Velocity: (-1.2214E-02, -5.4046E-02,  0.0000E+00)
            Max Velocity: ( 1.6817E-01,  4.2452E-02,  0.0000E+00)

          6: t =   5.52563E-03, dt(growth) =   1.27628E-03
projection solve:   34 (DS),    8 (AMG), 3.5401E-11 (|r|/|b|)

            Min Velocity: (-1.4752E-02, -6.6426E-02,  0.0000E+00)
            Max Velocity: ( 2.0623E-01,  4.9309E-02,  0.0000E+00)

          7: t =   6.80191E-03, dt(growth) =   1.34010E-03
projection solve:    4 (DS),   10 (AMG), 8.9859E-12 (|r|/|b|)

            Min Velocity: (-1.7350E-02, -7.9571E-02,  0.0000E+00)
            Max Velocity: ( 2.4524E-01,  5.4961E-02,  0.0000E+00)

          8: t =   8.14201E-03, dt(growth) =   1.40710E-03
projection solve:   13 (DS),    9 (AMG), 3.7892E-11 (|r|/|b|)

            Min Velocity: (-1.9999E-02, -9.3408E-02,  0.0000E+00)
            Max Velocity: ( 2.8501E-01,  5.9335E-02,  0.0000E+00)

          9: t =   9.54911E-03, dt(growth) =   1.47746E-03
projection solve:    6 (DS),   10 (AMG), 1.0047E-11 (|r|/|b|)

            Min Velocity: (-2.2688E-02, -1.0800E-01,  0.0000E+00)
            Max Velocity: ( 3.2533E-01,  6.7673E-02,  0.0000E+00)

         10: t =   1.10266E-02, dt(growth) =   1.55133E-03
projection solve:    3 (DS),   10 (AMG), 2.6861E-11 (|r|/|b|)

            Min Velocity: (-2.5407E-02, -1.2335E-01,  0.0000E+00)
            Max Velocity: ( 3.6600E-01,  7.5590E-02,  0.0000E+00)

         11: t =   1.25779E-02, dt(growth) =   1.62889E-03
projection solve:   11 (DS),   10 (AMG), 1.5156E-11 (|r|/|b|)

            Min Velocity: (-2.8134E-02, -1.3949E-01,  0.0000E+00)
            Max Velocity: ( 4.0686E-01,  8.2848E-02,  0.0000E+00)

         12: t =   1.42068E-02, dt(growth) =   1.71034E-03
projection solve:    8 (DS),   10 (AMG), 1.6565E-11 (|r|/|b|)

            Min Velocity: (-3.0848E-02, -1.5644E-01,  0.0000E+00)
            Max Velocity: ( 4.4776E-01,  8.8903E-02,  0.0000E+00)

         13: t =   1.59171E-02, dt(growth) =   1.79586E-03
projection solve:    8 (DS),   10 (AMG), 1.3668E-11 (|r|/|b|)

            Min Velocity: (-3.3521E-02, -1.7421E-01,  0.0000E+00)
            Max Velocity: ( 4.8863E-01,  9.2874E-02,  0.0000E+00)

         14: t =   1.77130E-02, dt(growth) =   1.88565E-03
projection solve:   27 (DS),    9 (AMG), 1.6154E-11 (|r|/|b|)

            Min Velocity: (-3.8684E-02, -1.9280E-01,  0.0000E+00)
            Max Velocity: ( 5.2942E-01,  9.5673E-02,  0.0000E+00)

         15: t =   1.95986E-02, dt(growth) =   1.97993E-03
projection solve:   15 (DS),    9 (AMG), 8.5419E-11 (|r|/|b|)

            Min Velocity: (-4.4094E-02, -2.1221E-01,  0.0000E+00)
            Max Velocity: ( 5.7016E-01,  1.1404E-01,  0.0000E+00)

         16: t =   2.15786E-02, dt(courant) =   1.92921E-03
projection solve:    7 (DS),    9 (AMG), 9.4836E-11 (|r|/|b|)

            Min Velocity: (-4.9314E-02, -2.3100E-01,  0.0000E+00)
            Max Velocity: ( 6.0832E-01,  1.3127E-01,  0.0000E+00)

         17: t =   2.35078E-02, dt(courant) =   1.81016E-03
projection solve:   22 (DS),    9 (AMG), 7.6641E-11 (|r|/|b|)

            Min Velocity: (-5.4145E-02, -2.4869E-01,  0.0000E+00)
            Max Velocity: ( 6.4279E-01,  1.3989E-01,  0.0000E+00)

         18: t =   2.53179E-02, dt(courant) =   1.71594E-03
projection solve:   16 (DS),    9 (AMG), 5.9512E-11 (|r|/|b|)

            Min Velocity: (-5.8484E-02, -2.6549E-01,  0.0000E+00)
            Max Velocity: ( 6.7414E-01,  1.4003E-01,  0.0000E+00)

         19: t =   2.70339E-02, dt(courant) =   1.63874E-03
projection solve:   18 (DS),   10 (AMG), 2.0973E-11 (|r|/|b|)

            Min Velocity: (-6.1166E-02, -2.8167E-01,  0.0000E+00)
            Max Velocity: ( 7.0308E-01,  1.4374E-01,  0.0000E+00)

         20: t =   2.86726E-02, dt(courant) =   1.57355E-03
projection solve:   17 (DS),   10 (AMG), 2.2784E-11 (|r|/|b|)

            Min Velocity: (-6.2306E-02, -2.9730E-01,  0.0000E+00)
            Max Velocity: ( 7.2993E-01,  1.5038E-01,  0.0000E+00)

         21: t =   3.02462E-02, dt(courant) =   1.51758E-03
projection solve:   17 (DS),   10 (AMG), 1.0470E-11 (|r|/|b|)

            Min Velocity: (-6.4472E-02, -3.1229E-01,  0.0000E+00)
            Max Velocity: ( 7.5496E-01,  1.4842E-01,  0.0000E+00)

         22: t =   3.17637E-02, dt(courant) =   1.46892E-03
projection solve:   25 (DS),    9 (AMG), 1.1666E-11 (|r|/|b|)

            Min Velocity: (-7.1378E-02, -3.2660E-01,  0.0000E+00)
            Max Velocity: ( 7.7855E-01,  1.5224E-01,  0.0000E+00)

         23: t =   3.32327E-02, dt(courant) =   1.42584E-03
projection solve:   22 (DS),    9 (AMG), 4.8534E-11 (|r|/|b|)

            Min Velocity: (-7.7779E-02, -3.4023E-01,  0.0000E+00)
            Max Velocity: ( 8.0090E-01,  1.6144E-01,  0.0000E+00)

         24: t =   3.46585E-02, dt(courant) =   1.38732E-03
projection solve:   33 (DS),    9 (AMG), 2.8617E-11 (|r|/|b|)

            Min Velocity: (-8.3867E-02, -3.5312E-01,  0.0000E+00)
            Max Velocity: ( 8.2206E-01,  1.6274E-01,  0.0000E+00)

         25: t =   3.60458E-02, dt(courant) =   1.35275E-03
projection solve:   48 (DS),    9 (AMG), 6.6935E-12 (|r|/|b|)

            Min Velocity: (-9.0455E-02, -3.6559E-01,  0.0000E+00)
            Max Velocity: ( 8.4219E-01,  1.6350E-01,  0.0000E+00)

         26: t =   3.73986E-02, dt(courant) =   1.32143E-03
projection solve:   27 (DS),   10 (AMG), 1.1654E-11 (|r|/|b|)

            Min Velocity: (-9.5816E-02, -3.7810E-01,  0.0000E+00)
            Max Velocity: ( 8.6149E-01,  1.6658E-01,  0.0000E+00)

         27: t =   3.87200E-02, dt(courant) =   1.29273E-03
projection solve:   25 (DS),    9 (AMG), 8.5230E-11 (|r|/|b|)

            Min Velocity: (-9.9165E-02, -3.9016E-01,  0.0000E+00)
            Max Velocity: ( 8.8005E-01,  1.6950E-01,  0.0000E+00)

         28: t =   4.00127E-02, dt(courant) =   1.26630E-03
projection solve:   21 (DS),    9 (AMG), 9.2754E-11 (|r|/|b|)

            Min Velocity: (-1.0157E-01, -4.0194E-01,  0.0000E+00)
            Max Velocity: ( 8.9777E-01,  1.6761E-01,  0.0000E+00)

         29: t =   4.12790E-02, dt(courant) =   1.24206E-03
projection solve:   23 (DS),    9 (AMG), 2.6171E-11 (|r|/|b|)

            Min Velocity: (-1.0201E-01, -4.1384E-01,  0.0000E+00)
            Max Velocity: ( 9.1491E-01,  1.7046E-01,  0.0000E+00)

         30: t =   4.25211E-02, dt(courant) =   1.21949E-03
projection solve:   28 (DS),    9 (AMG), 7.9828E-11 (|r|/|b|)

            Min Velocity: (-1.0174E-01, -4.2570E-01,  0.0000E+00)
            Max Velocity: ( 9.3142E-01,  1.7367E-01,  0.0000E+00)

         31: t =   4.37406E-02, dt(courant) =   1.19850E-03
projection solve:   33 (DS),    9 (AMG), 2.9680E-11 (|r|/|b|)

            Min Velocity: (-1.0273E-01, -4.3688E-01,  0.0000E+00)
            Max Velocity: ( 9.4742E-01,  1.7481E-01,  0.0000E+00)

         32: t =   4.49391E-02, dt(courant) =   1.17887E-03
projection solve:   33 (DS),    9 (AMG), 2.1084E-11 (|r|/|b|)

            Min Velocity: (-1.0621E-01, -4.4772E-01,  0.0000E+00)
            Max Velocity: ( 9.6280E-01,  1.7475E-01,  0.0000E+00)

         33: t =   4.61180E-02, dt(courant) =   1.16058E-03
projection solve:   28 (DS),    9 (AMG), 1.4772E-11 (|r|/|b|)

            Min Velocity: (-1.1393E-01, -4.5854E-01,  0.0000E+00)
            Max Velocity: ( 9.7785E-01,  1.7524E-01,  0.0000E+00)

         34: t =   4.72785E-02, dt(courant) =   1.14323E-03
projection solve:   29 (DS),    9 (AMG), 3.2355E-11 (|r|/|b|)

            Min Velocity: (-1.2036E-01, -4.6910E-01,  0.0000E+00)
            Max Velocity: ( 9.9237E-01,  1.7603E-01,  0.0000E+00)

         35: t =   4.84218E-02, dt(courant) =   1.12699E-03
projection solve:   26 (DS),    9 (AMG), 3.4897E-11 (|r|/|b|)

            Min Velocity: (-1.2586E-01, -4.7953E-01,  0.0000E+00)
            Max Velocity: ( 1.0065E+00,  1.7341E-01,  0.0000E+00)

         36: t =   4.95487E-02, dt(courant) =   1.11166E-03
projection solve:   36 (DS),    9 (AMG), 1.5444E-11 (|r|/|b|)

            Min Velocity: (-1.3158E-01, -4.9083E-01,  0.0000E+00)
            Max Velocity: ( 1.0203E+00,  1.7559E-01,  0.0000E+00)

         37: t =   5.06604E-02, dt(courant) =   1.09697E-03
projection solve:   29 (DS),    9 (AMG), 5.7172E-11 (|r|/|b|)

            Min Velocity: (-1.3526E-01, -5.0219E-01,  0.0000E+00)
            Max Velocity: ( 1.0337E+00,  1.7506E-01,  0.0000E+00)

         38: t =   5.17574E-02, dt(courant) =   1.08320E-03
projection solve:   33 (DS),    9 (AMG), 2.0596E-11 (|r|/|b|)

            Min Velocity: (-1.3634E-01, -5.1209E-01,  0.0000E+00)
            Max Velocity: ( 1.0467E+00,  1.7228E-01,  0.0000E+00)

         39: t =   5.28406E-02, dt(courant) =   1.07012E-03
projection solve:   28 (DS),    9 (AMG), 2.8963E-11 (|r|/|b|)

            Min Velocity: (-1.3687E-01, -5.2139E-01,  0.0000E+00)
            Max Velocity: ( 1.0595E+00,  1.7257E-01,  0.0000E+00)

         40: t =   5.39107E-02, dt(courant) =   1.05755E-03
projection solve:   30 (DS),    9 (AMG), 2.9775E-11 (|r|/|b|)

            Min Velocity: (-1.3690E-01, -5.3160E-01,  0.0000E+00)
            Max Velocity: ( 1.0720E+00,  1.7370E-01,  0.0000E+00)

         41: t =   5.49683E-02, dt(courant) =   1.04559E-03
projection solve:   31 (DS),    9 (AMG), 3.2312E-11 (|r|/|b|)

            Min Velocity: (-1.3645E-01, -5.4194E-01,  0.0000E+00)
            Max Velocity: ( 1.0842E+00,  1.6933E-01,  0.0000E+00)

         42: t =   5.60138E-02, dt(courant) =   1.03413E-03
projection solve:   28 (DS),    9 (AMG), 6.5208E-11 (|r|/|b|)

            Min Velocity: (-1.4223E-01, -5.5279E-01,  0.0000E+00)
            Max Velocity: ( 1.0959E+00,  1.6935E-01,  0.0000E+00)

         43: t =   5.70480E-02, dt(courant) =   1.02334E-03
projection solve:   35 (DS),    9 (AMG), 2.6070E-11 (|r|/|b|)

            Min Velocity: (-1.4775E-01, -5.6314E-01,  0.0000E+00)
            Max Velocity: ( 1.1076E+00,  1.6967E-01,  0.0000E+00)

         44: t =   5.80713E-02, dt(courant) =   1.01286E-03
projection solve:   33 (DS),    9 (AMG), 2.7300E-11 (|r|/|b|)

            Min Velocity: (-1.5028E-01, -5.7184E-01,  0.0000E+00)
            Max Velocity: ( 1.1192E+00,  1.6815E-01,  0.0000E+00)

         45: t =   5.90842E-02, dt(courant) =   1.00269E-03
projection solve:   35 (DS),    9 (AMG), 3.5388E-11 (|r|/|b|)

            Min Velocity: (-1.5199E-01, -5.7987E-01,  0.0000E+00)
            Max Velocity: ( 1.1302E+00,  1.6497E-01,  0.0000E+00)

         46: t =   6.00869E-02, dt(courant) =   9.93172E-04
projection solve:   35 (DS),    9 (AMG), 2.8968E-11 (|r|/|b|)

            Min Velocity: (-1.5275E-01, -5.8933E-01,  0.0000E+00)
            Max Velocity: ( 1.1411E+00,  1.6389E-01,  0.0000E+00)

         47: t =   6.10800E-02, dt(courant) =   9.83981E-04
projection solve:   32 (DS),    9 (AMG), 5.2510E-11 (|r|/|b|)

            Min Velocity: (-1.5248E-01, -5.9945E-01,  0.0000E+00)
            Max Velocity: ( 1.1520E+00,  1.6296E-01,  0.0000E+00)

         48: t =   6.20640E-02, dt(courant) =   9.74852E-04
projection solve:   32 (DS),    9 (AMG), 2.8213E-11 (|r|/|b|)

            Min Velocity: (-1.5140E-01, -6.0944E-01,  0.0000E+00)
            Max Velocity: ( 1.1626E+00,  1.6049E-01,  0.0000E+00)

         49: t =   6.30389E-02, dt(courant) =   9.66267E-04
projection solve:   39 (DS),    9 (AMG), 2.3137E-11 (|r|/|b|)

            Min Velocity: (-1.5089E-01, -6.1832E-01,  0.0000E+00)
            Max Velocity: ( 1.1728E+00,  1.5907E-01,  0.0000E+00)

         50: t =   6.40051E-02, dt(courant) =   9.58108E-04
projection solve:   36 (DS),    9 (AMG), 2.0819E-11 (|r|/|b|)

            Min Velocity: (-1.5468E-01, -6.2549E-01,  0.0000E+00)
            Max Velocity: ( 1.1830E+00,  1.5639E-01,  0.0000E+00)

         51: t =   6.49633E-02, dt(courant) =   9.50013E-04
projection solve:   37 (DS),    9 (AMG), 1.5056E-11 (|r|/|b|)

            Min Velocity: (-1.5730E-01, -6.3347E-01,  0.0000E+00)
            Max Velocity: ( 1.1931E+00,  1.5368E-01,  0.0000E+00)

         52: t =   6.59133E-02, dt(courant) =   9.42247E-04
projection solve:   37 (DS),    9 (AMG), 2.9001E-11 (|r|/|b|)

            Min Velocity: (-1.5860E-01, -6.4284E-01,  0.0000E+00)
            Max Velocity: ( 1.2029E+00,  1.5330E-01,  0.0000E+00)

         53: t =   6.68555E-02, dt(courant) =   9.34753E-04
projection solve:   37 (DS),    9 (AMG), 2.7972E-11 (|r|/|b|)

            Min Velocity: (-1.5878E-01, -6.5224E-01,  0.0000E+00)
            Max Velocity: ( 1.2128E+00,  1.5137E-01,  0.0000E+00)

         54: t =   6.77903E-02, dt(courant) =   9.27319E-04
projection solve:   35 (DS),    9 (AMG), 4.3467E-11 (|r|/|b|)

            Min Velocity: (-1.5765E-01, -6.6074E-01,  0.0000E+00)
            Max Velocity: ( 1.2223E+00,  1.4756E-01,  0.0000E+00)

         55: t =   6.87176E-02, dt(courant) =   9.20312E-04
projection solve:   38 (DS),    9 (AMG), 2.5333E-11 (|r|/|b|)

            Min Velocity: (-1.5535E-01, -6.6730E-01,  0.0000E+00)
            Max Velocity: ( 1.2316E+00,  1.4389E-01,  0.0000E+00)

         56: t =   6.96379E-02, dt(courant) =   9.13591E-04
projection solve:   38 (DS),    9 (AMG), 2.3789E-11 (|r|/|b|)

            Min Velocity: (-1.5520E-01, -6.7462E-01,  0.0000E+00)
            Max Velocity: ( 1.2411E+00,  1.4383E-01,  0.0000E+00)

         57: t =   7.05515E-02, dt(time) =   9.05534E-04
projection solve:   39 (DS),    9 (AMG), 1.3237E-11 (|r|/|b|)

            Min Velocity: (-1.5770E-01, -6.8318E-01,  0.0000E+00)
            Max Velocity: ( 1.2503E+00,  1.4142E-01,  0.0000E+00)

         58: t =   7.14570E-02, dt(time) =   8.97548E-04
projection solve:   39 (DS),    9 (AMG), 3.2990E-11 (|r|/|b|)

            Min Velocity: (-1.5919E-01, -6.9183E-01,  0.0000E+00)
            Max Velocity: ( 1.2593E+00,  1.3858E-01,  0.0000E+00)

         59: t =   7.23546E-02, dt(time) =   8.89632E-04
projection solve:   34 (DS),    9 (AMG), 6.6179E-11 (|r|/|b|)

            Min Velocity: (-1.5905E-01, -6.9946E-01,  0.0000E+00)
            Max Velocity: ( 1.2680E+00,  1.3310E-01,  0.0000E+00)

         60: t =   7.32442E-02, dt(time) =   8.81787E-04
projection solve:   36 (DS),    9 (AMG), 1.1335E-11 (|r|/|b|)

            Min Velocity: (-1.5761E-01, -7.0579E-01,  0.0000E+00)
            Max Velocity: ( 1.2768E+00,  1.3244E-01,  0.0000E+00)

         61: t =   7.41260E-02, dt(time) =   8.74011E-04
projection solve:   44 (DS),    9 (AMG), 9.6193E-12 (|r|/|b|)

            Min Velocity: (-1.5556E-01, -7.1389E-01,  0.0000E+00)
            Max Velocity: ( 1.2855E+00,  1.3022E-01,  0.0000E+00)

================================================================================

TERMINATION

                 Final Time:  7.5000E-02 after    61 steps


TIMING SUMMARY
--------------
  6.972E+00 --- Total
    6.021E-03 --- Input
    3.249E+00 --- Initialization
      9.550E-04 --- Vof Initialization
      2.867E-02 --- Flow
        7.290E-04 --- update properties
        1.124E-02 --- setup
        1.214E-02 --- solve
          4.529E-03 --- hypre solve
    3.712E+00 --- Main Cycle
      8.621E-03 --- Time Step
      2.102E+00 --- Volumetracking
        6.838E-01 --- normals
        1.048E+00 --- reconstruct/advect
      1.575E+00 --- Flow
        4.433E-02 --- update properties
        2.125E-01 --- prediction
          1.396E-01 --- setup
          7.082E-02 --- solve
        1.235E+00 --- projection
          5.259E-01 --- setup
          7.080E-01 --- solve
            2.882E-01 --- hypre solve

                  Process virtual memory used: 4.38E+02 mB
                                   words/cell: 27307

truchas terminated normally on 26 Aug 19 at 15:23:59
