
================================================================================

PROGRAM INFORMATION

   code:                Truchas
   version:             3.1.0-alpha
   build architecture:  x86_64
   build date/time:     2020-05-19 21:03:09
   build flags:         -u -C -C=dangling -gline -nan
   build host:          thelio.indiana
   run architecture:    Linux thelio.indiana 5.3.11-100
   run host:
   run date/time:       19 May 20 22:11:56
   processors:          1

================================================================================

COPYRIGHT

   Copyright 2007-2019.  Triad National Security, LLC.  All rights reserved.

   This program was produced under U.S. Government contract 89233218CNA000001
   for Los Alamos National Laboratory (LANL), which is operated by Triad
   National Security, LLC for the U.S. Department of Energy/National Nuclear
   Security Administration.

   Truchas is open source software distributed under the 3-Clause BSD License.

================================================================================

INPUT

Opening input file htvoid1-old.inp ...

Reading FUNCTION namelists ...
  Reading FUNCTION namelist #1

Reading VFUNCTION namelists ...

Reading TOOLPATH namelists ...

Reading PHYSICS namelist ...

Reading MATERIAL namelists ...

Reading PHASE namelists ...

Reading PHASE_CHANGE namelists ...

 Reading OUTPUTS Namelist ...

Reading MESH namelist ...

 Reading LINEAR_SOLVER Namelist(s) ...

         Reading LINEAR_SOLVER Namelist # 1 ...

Reading NONLINEAR_SOLVER Namelists ...
  NONLINEAR_SOLVER namelist not found; using defaults.

 Reading BODY Namelist # 1 ...

 Reading BODY Namelist # 2 ...

Reading BODY namelists ...

Reading NUMERICS namelist ...

Reading LEGACY_FLOW namelist ...
Using linear solver "projection" for projection linear solution.
Warning: Linear solver "default" for viscous linear solution not found! Reverting to default linear solver parameters.
MATERIAL_PRIORITY not specified; defaulting to material input order

         Material Priorities

         Material    Priority
         --------    --------
               fluid        1
                VOID        2

 Reading BC Namelists ...
BC namelists not found; using defaults.

Reading DIFFUSION_SOLVER namelist ...
  using default MAX_NLK_VEC value: MAX_NLK_ITR - 1
  using default NLK_VEC_TOL value: 1.00E-03
  using default PC_AMG_CYCLES value: 2

Reading THERMAL_BC namelists ...

Reading SPECIES_BC namelists ...

Reading DS_SOURCE namelists ...
  No DS_SOURCE namelists found.

Reading ENCLOSURE_RADIATION namelists ...

Reading ENCLOSURE_SURFACE namelists ...

Reading PROBE namelists ...
  no PROBE namelists found

Input file htvoid1-old.inp closed.

================================================================================

INITIALIZATION


Initializing mesh "MAIN" ...
  reading ExodusII mesh file "./channel-3.gen"
  finding cell neighbors
  partitioning the mesh cells
  partitioning the mesh nodes
  numbering the mesh faces
  partitioning the mesh faces
  identifying off-process ghost cells
  generating parallel mesh structure
  UNSTR_MESH Profile:
     PE|    nnode    nface    ncell
    ---+---------------------------
      1|      400      801      216
  Mesh Communication Profile:
              Nodes           Faces           Cells
     PE|  off-PE   on-PE  off-PE   on-PE  off-PE   on-PE
    ---+------------------------------------------------
      1|      0      400      0      801      0      216
  Mesh "MAIN" initialized

Allocating base derived types A ...done.

Computing initial volume fractions ...
  Initial volume fractions computed.
 Initializing Displacement Boundary Conditions

 Locating cell faces for which BCs are to be applied ...
 Initializing Pressure Boundary Conditions
   DIRICHLET: 0 boundary points
   REFLECTIVE: 306 boundary points
   EXTERIOR: 306 boundary points
   NEUMANN: 0 boundary points
   HNEUMANN: 306 boundary points
 Pressure BCs initialized.

 Finished BC initialization.

Initializing diffusion solver ...
  Generating external source for "temperature" equation
Generating "interface-htc" thermal interface condition
  none specified
Generating "gap-radiation" thermal interface condition
  none specified
Generating "flux" thermal boundary condition
  using THERMAL_BC[whole boundary]
Generating "htc" thermal boundary condition
  none specified
Generating "radiation" thermal boundary condition
  none specified
Generating "temperature" thermal boundary condition
  none specified
  Diffusion solver initialized.
Initializing solution probes ...

================================================================================

EXECUTION

 Linear solver name: projection
       iter         ||r||           err
          0      0.34603E+00    0.34603E+00
          1      0.31284E-01    0.31284E-01
          2      0.63296E-02    0.63296E-02
          3      0.42846E-03    0.42846E-03
          4      0.72056E-05    0.72056E-05
          5      0.14885E-06    0.14885E-06
          6      0.22748E-08    0.22748E-08

          1: t =   0.00000E+00, dt(initial) =   1.00000E-02
Warning: excessive volume adjustment: cell=32, matid=1, adjustment fraction=  7.632E-09
Warning: excessive volume adjustment: cell=33, matid=1, adjustment fraction=  7.687E-09
Warning: excessive volume adjustment: cell=34, matid=1, adjustment fraction=  1.116E-08
Warning: excessive volume adjustment: cell=35, matid=1, adjustment fraction=  5.150E-09
Warning: excessive volume adjustment: cell=36, matid=1, adjustment fraction= -2.115E-10
Warning: excessive volume adjustment: cell=37, matid=1, adjustment fraction= -4.537E-11
Warning: excessive volume adjustment: cell=38, matid=1, adjustment fraction=  1.529E-10
Warning: excessive volume adjustment: cell=39, matid=1, adjustment fraction= -2.917E-10
Warning: excessive volume adjustment: cell=40, matid=1, adjustment fraction=  2.749E-11
Warning: excessive volume adjustment: cell=41, matid=1, adjustment fraction= -3.396E-10
Warning: excessive volume adjustment: cell=42, matid=1, adjustment fraction= -2.089E-11
Warning: excessive volume adjustment: cell=43, matid=1, adjustment fraction= -4.029E-10
Warning: excessive volume adjustment: cell=44, matid=1, adjustment fraction= -6.279E-11
Warning: excessive volume adjustment: cell=100, matid=1, adjustment fraction=  9.133E-07
Warning: excessive volume adjustment: cell=32, matid=1, adjustment fraction=  3.816E-09
Warning: excessive volume adjustment: cell=33, matid=1, adjustment fraction=  3.843E-09
Warning: excessive volume adjustment: cell=34, matid=1, adjustment fraction=  5.579E-09
Warning: excessive volume adjustment: cell=35, matid=1, adjustment fraction=  2.575E-09
Warning: excessive volume adjustment: cell=36, matid=1, adjustment fraction= -1.058E-10
Warning: excessive volume adjustment: cell=37, matid=1, adjustment fraction= -2.269E-11
Warning: excessive volume adjustment: cell=38, matid=1, adjustment fraction=  1.876E-08
Warning: excessive volume adjustment: cell=39, matid=1, adjustment fraction= -1.459E-10
Warning: excessive volume adjustment: cell=40, matid=1, adjustment fraction=  1.375E-11
Warning: excessive volume adjustment: cell=41, matid=1, adjustment fraction= -1.698E-10
DS: totally/essentially/non-void cell counts = 119/0/97
DS: T(H) iterations:  0.00(avg), 0(max)
DS: T(H) salvage rate = 0.000; interval adjustments =  0.00(avg), 0(max)

DS: dt=1.000E-02, NFUN:NPC:NPA=0000003:0000001:0000002
 Linear solver name: projection
       iter         ||r||           err
          0      0.75335E-03    0.75335E-03
          1      0.84237E-04    0.84237E-04
          2      0.92143E-05    0.92143E-05
          3      0.71552E-06    0.71552E-06
          4      0.12384E-07    0.12384E-07
          5      0.19990E-09    0.19990E-09
            6 Preliminary projection iterations (linear)
            5 Projection iterations (linear)

            Min Velocity: ( 0.0000E+00, -4.6587E-03, -5.1619E-03)
            Max Velocity: ( 6.1104E-02,  4.9046E-03,  5.1138E-03)

          2: t =   1.00000E-02, dt(growth) =   1.05000E-02
DS: totally/essentially/non-void cell counts = 119/0/97
DS: T(H) iterations:  0.00(avg), 0(max)
DS: T(H) salvage rate = 0.000; interval adjustments =  0.00(avg), 0(max)

DS: dt=1.050E-02, NFUN:NPC:NPA=0000006:0000002:0000004
 Linear solver name: projection
       iter         ||r||           err
          0      0.26397E+00    0.26397E+00
          1      0.76346E-01    0.76346E-01
          2      0.10819E-01    0.10819E-01
          3      0.57418E-03    0.57418E-03
          4      0.92217E-05    0.92217E-05
          5      0.83897E-07    0.83897E-07
          6      0.95804E-09    0.95804E-09
            6 Projection iterations (linear)

            Min Velocity: ( 0.0000E+00, -8.0704E-03, -8.8694E-03)
            Max Velocity: ( 1.2451E-01,  8.8756E-03,  9.0122E-03)

          3: t =   2.05000E-02, dt(growth) =   1.10250E-02
DS: totally/essentially/non-void cell counts = 117/2/97
DS: T(H) iterations:  0.00(avg), 0(max)
DS: T(H) salvage rate = 0.000; interval adjustments =  0.00(avg), 0(max)

DS: dt=1.103E-02, NFUN:NPC:NPA=0000009:0000003:0000006
 Linear solver name: projection
       iter         ||r||           err
          0      0.62823E-01    0.62823E-01
          1      0.15738E-01    0.15738E-01
          2      0.89818E-03    0.89818E-03
          3      0.46402E-04    0.46402E-04
          4      0.64797E-06    0.64797E-06
          5      0.12538E-07    0.12538E-07
          6      0.22217E-09    0.22217E-09
            6 Projection iterations (linear)

            Min Velocity: ( 0.0000E+00, -1.0629E-02, -1.1907E-02)
            Max Velocity: ( 1.9120E-01,  1.2146E-02,  1.2234E-02)

          4: t =   3.15250E-02, dt(growth) =   1.15763E-02
DS: totally/essentially/non-void cell counts = 117/2/97
DS: T(H) iterations:  0.50(avg), 1(max)
DS: T(H) salvage rate = 0.000; interval adjustments =  0.00(avg), 0(max)

DS: dt=1.158E-02, NFUN:NPC:NPA=0000012:0000004:0000008
 Linear solver name: projection
       iter         ||r||           err
          0      0.61564E-01    0.61564E-01
          1      0.13877E-01    0.13877E-01
          2      0.24325E-02    0.24325E-02
          3      0.76095E-04    0.76095E-04
          4      0.14831E-05    0.14831E-05
          5      0.23525E-07    0.23525E-07
          6      0.24201E-09    0.24201E-09
            6 Projection iterations (linear)

            Min Velocity: ( 0.0000E+00, -1.2545E-02, -1.4553E-02)
            Max Velocity: ( 2.6175E-01,  1.4952E-02,  1.5054E-02)

          5: t =   4.31013E-02, dt(growth) =   1.21551E-02
Warning: excessive volume adjustment: cell=101, adjustment fraction=  2.061E-06
DS: totally/essentially/non-void cell counts = 117/2/97
DS: T(H) iterations:  1.29(avg), 3(max)
DS: T(H) salvage rate = 0.143; interval adjustments =  1.00(avg), 1(max)

DS: dt=1.216E-02, NFUN:NPC:NPA=0000015:0000005:0000010
 Linear solver name: projection
       iter         ||r||           err
          0      0.68259E-01    0.68259E-01
          1      0.22021E-01    0.22021E-01
          2      0.72986E-03    0.72986E-03
          3      0.24832E-04    0.24832E-04
          4      0.17770E-05    0.17770E-05
          5      0.23188E-07    0.23188E-07
          6      0.19659E-09    0.19659E-09
            6 Projection iterations (linear)

            Min Velocity: ( 0.0000E+00, -1.4319E-02, -1.6917E-02)
            Max Velocity: ( 3.3750E-01,  1.7429E-02,  1.7619E-02)

          6: t =   5.52563E-02, dt(growth) =   1.27628E-02
DS: totally/essentially/non-void cell counts = 117/2/97
DS: T(H) iterations:  1.50(avg), 3(max)
DS: T(H) salvage rate = 0.200; interval adjustments =  1.00(avg), 1(max)

DS: dt=1.276E-02, NFUN:NPC:NPA=0000018:0000006:0000012
 Linear solver name: projection
       iter         ||r||           err
          0      0.83049E-01    0.83049E-01
          1      0.24299E-01    0.24299E-01
          2      0.34369E-02    0.34369E-02
          3      0.18342E-03    0.18342E-03
          4      0.29347E-05    0.29347E-05
          5      0.36873E-07    0.36873E-07
          6      0.28912E-09    0.28912E-09
            6 Projection iterations (linear)

            Min Velocity: ( 0.0000E+00, -1.5938E-02, -1.9057E-02)
            Max Velocity: ( 4.1302E-01,  1.9673E-02,  2.1285E-02)

          7: t =   6.80191E-02, dt(growth) =   1.34010E-02
DS: totally/essentially/non-void cell counts = 118/2/96
DS: T(H) iterations:  1.50(avg), 3(max)
DS: T(H) salvage rate = 0.333; interval adjustments =  1.00(avg), 1(max)

DS: dt=1.340E-02, NFUN:NPC:NPA=0000021:0000007:0000014
 Linear solver name: projection
       iter         ||r||           err
          0      0.27670E-01    0.27670E-01
          1      0.10064E-02    0.10064E-02
          2      0.16845E-03    0.16845E-03
          3      0.12024E-04    0.12024E-04
          4      0.27672E-06    0.27672E-06
          5      0.64783E-08    0.64783E-08
          6      0.84642E-10    0.84642E-10
            6 Projection iterations (linear)

            Min Velocity: ( 0.0000E+00, -1.7868E-02, -2.1004E-02)
            Max Velocity: ( 4.8020E-01,  2.1733E-02,  2.2305E-02)

          8: t =   8.14201E-02, dt(growth) =   1.40710E-02
DS: totally/essentially/non-void cell counts = 120/2/94
DS: T(H) iterations:  1.57(avg), 3(max)
DS: T(H) salvage rate = 0.286; interval adjustments =  1.00(avg), 1(max)

DS: dt=1.407E-02, NFUN:NPC:NPA=0000024:0000008:0000016
 Linear solver name: projection
       iter         ||r||           err
          0      0.16946E+00    0.16946E+00
          1      0.26917E-01    0.26917E-01
          2      0.30831E-02    0.30831E-02
          3      0.12764E-03    0.12764E-03
          4      0.30459E-05    0.30459E-05
          5      0.37964E-07    0.37964E-07
          6      0.45153E-09    0.45153E-09
            6 Projection iterations (linear)

            Min Velocity: ( 0.0000E+00, -2.0017E-02, -2.4956E-02)
            Max Velocity: ( 5.5960E-01,  2.5398E-02,  2.4502E-02)

          9: t =   9.54911E-02, dt(growth) =   1.47746E-02
DS: culled material fragments from 1 cells.
DS: totally/essentially/non-void cell counts = 121/2/93
DS: T(H) iterations:  1.62(avg), 3(max)
DS: T(H) salvage rate = 0.312; interval adjustments =  1.00(avg), 1(max)

DS: dt=1.477E-02, NFUN:NPC:NPA=0000027:0000009:0000018
 Linear solver name: projection
       iter         ||r||           err
          0      0.12918E+00    0.12918E+00
          1      0.27914E-01    0.27914E-01
          2      0.35540E-02    0.35540E-02
          3      0.12078E-03    0.12078E-03
          4      0.27433E-05    0.27433E-05
          5      0.39939E-07    0.39939E-07
          6      0.53898E-09    0.53898E-09
            6 Projection iterations (linear)

            Min Velocity: ( 0.0000E+00, -1.5462E-02, -2.4404E-02)
            Max Velocity: ( 6.4628E-01,  2.5782E-02,  2.6662E-02)

         10: t =   1.10266E-01, dt(growth) =   1.55133E-02
DS: totally/essentially/non-void cell counts = 123/3/90
DS: T(H) iterations:  1.74(avg), 4(max)
DS: T(H) salvage rate = 0.263; interval adjustments =  1.00(avg), 1(max)

DS: dt=1.551E-02, NFUN:NPC:NPA=0000030:0000010:0000020
 Linear solver name: projection
       iter         ||r||           err
          0      0.95944E-01    0.95944E-01
          1      0.18115E-01    0.18115E-01
          2      0.25925E-02    0.25925E-02
          3      0.11347E-03    0.11347E-03
          4      0.24468E-05    0.24468E-05
          5      0.45982E-07    0.45982E-07
          6      0.55079E-09    0.55079E-09
            6 Projection iterations (linear)

            Min Velocity: ( 0.0000E+00, -1.6786E-02, -2.5848E-02)
            Max Velocity: ( 7.3732E-01,  2.8204E-02,  2.8791E-02)

         11: t =   1.25779E-01, dt(growth) =   1.62889E-02
DS: totally/essentially/non-void cell counts = 125/1/90
DS: T(H) iterations:  1.70(avg), 4(max)
DS: T(H) salvage rate = 0.250; interval adjustments =  1.00(avg), 1(max)

DS: dt=1.629E-02, NFUN:NPC:NPA=0000033:0000011:0000022
 Linear solver name: projection
       iter         ||r||           err
          0      0.98107E-01    0.98107E-01
          1      0.96421E-02    0.96421E-02
          2      0.10520E-02    0.10520E-02
          3      0.61029E-04    0.61029E-04
          4      0.17638E-05    0.17638E-05
          5      0.22763E-07    0.22763E-07
          6      0.39334E-09    0.39334E-09
            6 Projection iterations (linear)

            Min Velocity: ( 0.0000E+00, -1.8526E-02, -2.7104E-02)
            Max Velocity: ( 8.3285E-01,  3.0981E-02,  3.0884E-02)

         12: t =   1.42068E-01, dt(growth) =   1.71034E-02
DS: totally/essentially/non-void cell counts = 126/0/90
DS: T(H) iterations:  1.70(avg), 4(max)
DS: T(H) salvage rate = 0.250; interval adjustments =  1.00(avg), 1(max)

DS: dt=1.710E-02, NFUN:NPC:NPA=0000036:0000012:0000024
 Linear solver name: projection
       iter         ||r||           err
          0      0.10286E+00    0.10286E+00
          1      0.10716E-01    0.10716E-01
          2      0.87276E-03    0.87276E-03
          3      0.38507E-04    0.38507E-04
          4      0.12925E-05    0.12925E-05
          5      0.31065E-07    0.31065E-07
          6      0.45871E-09    0.45871E-09
            6 Projection iterations (linear)

            Min Velocity: ( 0.0000E+00, -2.0498E-02, -2.8147E-02)
            Max Velocity: ( 9.3303E-01,  3.3824E-02,  3.2947E-02)

         13: t =   1.59171E-01, dt(growth) =   1.79586E-02
DS: totally/essentially/non-void cell counts = 126/0/90
DS: T(H) iterations:  1.70(avg), 4(max)
DS: T(H) salvage rate = 0.250; interval adjustments =  1.00(avg), 1(max)

DS: dt=1.796E-02, NFUN:NPC:NPA=0000039:0000013:0000026
 Linear solver name: projection
       iter         ||r||           err
          0      0.83151E-01    0.83151E-01
          1      0.19736E-01    0.19736E-01
          2      0.34620E-02    0.34620E-02
          3      0.11894E-03    0.11894E-03
          4      0.20951E-05    0.20951E-05
          5      0.34194E-07    0.34194E-07
          6      0.39768E-09    0.39768E-09
            6 Projection iterations (linear)

            Min Velocity: ( 0.0000E+00, -2.2035E-02, -2.8934E-02)
            Max Velocity: ( 1.0379E+00,  3.6616E-02,  3.4960E-02)

         14: t =   1.77130E-01, dt(growth) =   1.88565E-02
DS: totally/essentially/non-void cell counts = 126/0/90
DS: T(H) iterations:  1.70(avg), 4(max)
DS: T(H) salvage rate = 0.250; interval adjustments =  1.00(avg), 1(max)

DS: dt=1.886E-02, NFUN:NPC:NPA=0000042:0000014:0000028
 Linear solver name: projection
       iter         ||r||           err
          0      0.49069E-01    0.49069E-01
          1      0.14062E-01    0.14062E-01
          2      0.16328E-02    0.16328E-02
          3      0.59172E-04    0.59172E-04
          4      0.94174E-06    0.94174E-06
          5      0.14264E-07    0.14264E-07
          6      0.17276E-09    0.17276E-09
            6 Projection iterations (linear)

            Min Velocity: ( 0.0000E+00, -2.3382E-02, -2.9786E-02)
            Max Velocity: ( 1.1478E+00,  3.9352E-02,  3.6934E-02)

         15: t =   1.95986E-01, dt(growth) =   1.97993E-02
DS: totally/essentially/non-void cell counts = 126/0/90
DS: T(H) iterations:  1.70(avg), 4(max)
DS: T(H) salvage rate = 0.250; interval adjustments =  1.00(avg), 1(max)

DS: dt=1.980E-02, NFUN:NPC:NPA=0000045:0000015:0000030
 Linear solver name: projection
       iter         ||r||           err
          0      0.80994E-02    0.80994E-02
          1      0.21570E-02    0.21570E-02
          2      0.35750E-03    0.35750E-03
          3      0.72738E-05    0.72738E-05
          4      0.72245E-07    0.72245E-07
          5      0.14607E-08    0.14607E-08
            5 Projection iterations (linear)

            Min Velocity: ( 0.0000E+00, -2.4639E-02, -3.0413E-02)
            Max Velocity: ( 1.2630E+00,  4.1976E-02,  3.8860E-02)

         16: t =   2.15786E-01, dt(growth) =   2.07893E-02
DS: totally/essentially/non-void cell counts = 126/0/90
DS: T(H) iterations:  1.70(avg), 4(max)
DS: T(H) salvage rate = 0.250; interval adjustments =  1.00(avg), 1(max)

DS: dt=2.079E-02, NFUN:NPC:NPA=0000048:0000016:0000032
 Linear solver name: projection
       iter         ||r||           err
          0      0.17379E-01    0.17379E-01
          1      0.51014E-02    0.51014E-02
          2      0.55355E-03    0.55355E-03
          3      0.21927E-04    0.21927E-04
          4      0.37088E-06    0.37088E-06
          5      0.52844E-08    0.52844E-08
          6      0.83616E-10    0.83616E-10
            6 Projection iterations (linear)

            Min Velocity: ( 0.0000E+00, -2.6602E-02, -3.0755E-02)
            Max Velocity: ( 1.3837E+00,  4.4413E-02,  4.0722E-02)

         17: t =   2.36575E-01, dt(growth) =   2.18287E-02
DS: totally/essentially/non-void cell counts = 126/0/90
DS: T(H) iterations:  1.70(avg), 4(max)
DS: T(H) salvage rate = 0.250; interval adjustments =  1.00(avg), 1(max)

DS: dt=2.183E-02, NFUN:NPC:NPA=0000051:0000017:0000034
 Linear solver name: projection
       iter         ||r||           err
          0      0.17796E-01    0.17796E-01
          1      0.53814E-03    0.53814E-03
          2      0.34954E-04    0.34954E-04
          3      0.75581E-05    0.75581E-05
          4      0.57814E-06    0.57814E-06
          5      0.88002E-08    0.88002E-08
          6      0.14006E-09    0.14006E-09
            6 Projection iterations (linear)

            Min Velocity: ( 0.0000E+00, -2.8927E-02, -3.1678E-02)
            Max Velocity: ( 1.5100E+00,  4.6576E-02,  4.2500E-02)

         18: t =   2.58404E-01, dt(growth) =   2.29202E-02
DS: totally/essentially/non-void cell counts = 126/0/90
DS: T(H) iterations:  1.70(avg), 4(max)
DS: T(H) salvage rate = 0.250; interval adjustments =  1.00(avg), 1(max)

DS: dt=2.292E-02, NFUN:NPC:NPA=0000054:0000018:0000036
 Linear solver name: projection
       iter         ||r||           err
          0      0.29484E-01    0.29484E-01
          1      0.98291E-02    0.98291E-02
          2      0.85636E-03    0.85636E-03
          3      0.30417E-04    0.30417E-04
          4      0.36784E-06    0.36784E-06
          5      0.78783E-08    0.78783E-08
          6      0.10165E-09    0.10165E-09
            6 Projection iterations (linear)

            Min Velocity: ( 0.0000E+00, -3.1273E-02, -3.2933E-02)
            Max Velocity: ( 1.6423E+00,  4.8370E-02,  4.4162E-02)

         19: t =   2.81324E-01, dt(growth) =   2.40662E-02
DS: totally/essentially/non-void cell counts = 126/0/90
DS: T(H) iterations:  1.70(avg), 4(max)
DS: T(H) salvage rate = 0.250; interval adjustments =  1.00(avg), 1(max)

DS: dt=2.407E-02, NFUN:NPC:NPA=0000057:0000019:0000038
 Linear solver name: projection
       iter         ||r||           err
          0      0.59158E-02    0.59158E-02
          1      0.75135E-03    0.75135E-03
          2      0.15828E-03    0.15828E-03
          3      0.67083E-05    0.67083E-05
          4      0.13173E-06    0.13173E-06
          5      0.28283E-08    0.28283E-08
          6      0.29945E-10    0.29945E-10
            6 Projection iterations (linear)

            Min Velocity: ( 0.0000E+00, -3.3568E-02, -3.4043E-02)
            Max Velocity: ( 1.7806E+00,  4.9691E-02,  4.5669E-02)

         20: t =   3.05390E-01, dt(growth) =   2.52695E-02
DS: totally/essentially/non-void cell counts = 126/0/90
DS: T(H) iterations:  1.70(avg), 4(max)
DS: T(H) salvage rate = 0.250; interval adjustments =  1.00(avg), 1(max)

DS: dt=2.527E-02, NFUN:NPC:NPA=0000060:0000020:0000040
 Linear solver name: projection
       iter         ||r||           err
          0      0.34362E-01    0.34362E-01
          1      0.24542E-02    0.24542E-02
          2      0.71543E-03    0.71543E-03
          3      0.38115E-04    0.38115E-04
          4      0.45069E-06    0.45069E-06
          5      0.49035E-08    0.49035E-08
          6      0.79122E-10    0.79122E-10
            6 Projection iterations (linear)

            Min Velocity: ( 0.0000E+00, -3.5722E-02, -3.4865E-02)
            Max Velocity: ( 1.9252E+00,  5.0433E-02,  4.6964E-02)

         21: t =   3.30660E-01, dt(growth) =   2.65330E-02
DS: totally/essentially/non-void cell counts = 118/2/96
DS: T(H) iterations:  1.45(avg), 4(max)
DS: T(H) salvage rate = 0.323; interval adjustments =  1.00(avg), 1(max)

DS: dt=2.653E-02, NFUN:NPC:NPA=0000063:0000021:0000042
 Linear solver name: projection
       iter         ||r||           err
          0      0.89003E+00    0.89003E+00
          1      0.15284E+00    0.15284E+00
          2      0.24144E-01    0.24144E-01
          3      0.91429E-03    0.91429E-03
          4      0.25238E-04    0.25238E-04
          5      0.26424E-06    0.26424E-06
          6      0.31774E-08    0.31774E-08
          7      0.34450E-10    0.34450E-10
            7 Projection iterations (linear)

            Min Velocity: ( 0.0000E+00, -3.7591E-02, -6.5416E-02)
            Max Velocity: ( 2.0774E+00,  5.0372E-02,  4.7948E-02)

         22: t =   3.57193E-01, dt(growth) =   2.78596E-02
DS: totally/essentially/non-void cell counts = 121/5/90
DS: T(H) iterations:  1.42(avg), 4(max)
DS: T(H) salvage rate = 0.333; interval adjustments =  1.00(avg), 1(max)

DS: dt=2.786E-02, NFUN:NPC:NPA=0000066:0000022:0000044
 Linear solver name: projection
       iter         ||r||           err
          0      0.25217E+00    0.25217E+00
          1      0.42369E-01    0.42369E-01
          2      0.18065E-02    0.18065E-02
          3      0.11504E-03    0.11504E-03
          4      0.31342E-05    0.31342E-05
          5      0.29752E-07    0.29752E-07
          6      0.82975E-09    0.82975E-09
            6 Projection iterations (linear)

            Min Velocity: ( 0.0000E+00, -6.8659E-02, -7.2815E-02)
            Max Velocity: ( 2.2442E+00,  4.9700E-02,  4.8543E-02)

         23: t =   3.85052E-01, dt(growth) =   2.92526E-02
DS: culled material fragments from 1 cells.
DS: totally/essentially/non-void cell counts = 123/3/90
DS: T(H) iterations:  1.44(avg), 4(max)
DS: T(H) salvage rate = 0.359; interval adjustments =  1.00(avg), 1(max)

DS: dt=2.925E-02, NFUN:NPC:NPA=0000069:0000023:0000046
 Linear solver name: projection
       iter         ||r||           err
          0      0.10485E+00    0.10485E+00
          1      0.19837E-01    0.19837E-01
          2      0.57336E-03    0.57336E-03
          3      0.80866E-05    0.80866E-05
          4      0.49680E-06    0.49680E-06
          5      0.17713E-07    0.17713E-07
          6      0.35407E-09    0.35407E-09
            6 Projection iterations (linear)

            Min Velocity: ( 0.0000E+00, -1.2998E-01, -5.4103E-02)
            Max Velocity: ( 2.4187E+00,  4.8837E-02,  4.8642E-02)

         24: t =   4.14305E-01, dt(growth) =   3.07152E-02
DS: culled material fragments from 1 cells.
DS: totally/essentially/non-void cell counts = 126/0/90
DS: T(H) iterations:  1.44(avg), 4(max)
DS: T(H) salvage rate = 0.359; interval adjustments =  1.00(avg), 1(max)

DS: dt=3.072E-02, NFUN:NPC:NPA=0000072:0000024:0000048
 Linear solver name: projection
       iter         ||r||           err
          0      0.13344E+00    0.13344E+00
          1      0.21020E-01    0.21020E-01
          2      0.17447E-02    0.17447E-02
          3      0.10419E-03    0.10419E-03
          4      0.23339E-05    0.23339E-05
          5      0.36414E-07    0.36414E-07
          6      0.71942E-09    0.71942E-09
            6 Projection iterations (linear)

            Min Velocity: ( 0.0000E+00, -4.0552E-02, -4.5556E-02)
            Max Velocity: ( 2.5855E+00,  4.7449E-02,  4.8179E-02)

         25: t =   4.45020E-01, dt(growth) =   3.22510E-02
DS: totally/essentially/non-void cell counts = 126/0/90
DS: T(H) iterations:  1.44(avg), 4(max)
DS: T(H) salvage rate = 0.359; interval adjustments =  1.00(avg), 1(max)

DS: dt=3.225E-02, NFUN:NPC:NPA=0000075:0000025:0000050
 Linear solver name: projection
       iter         ||r||           err
          0      0.89914E-01    0.89914E-01
          1      0.81017E-02    0.81017E-02
          2      0.23962E-02    0.23962E-02
          3      0.86139E-04    0.86139E-04
          4      0.22992E-05    0.22992E-05
          5      0.30223E-07    0.30223E-07
          6      0.36496E-09    0.36496E-09
            6 Projection iterations (linear)

            Min Velocity: ( 0.0000E+00, -4.0066E-02, -4.5954E-02)
            Max Velocity: ( 2.7733E+00,  4.6891E-02,  4.6930E-02)

         26: t =   4.77271E-01, dt(growth) =   3.38635E-02
DS: totally/essentially/non-void cell counts = 119/0/97
DS: T(H) iterations:  1.25(avg), 4(max)
DS: T(H) salvage rate = 0.312; interval adjustments =  1.00(avg), 1(max)

DS: dt=3.386E-02, NFUN:NPC:NPA=0000078:0000026:0000052
 Linear solver name: projection
       iter         ||r||           err
          0      0.10592E+01    0.10592E+01
          1      0.51496E-01    0.51496E-01
          2      0.86506E-02    0.86506E-02
          3      0.92578E-03    0.92578E-03
          4      0.27260E-04    0.27260E-04
          5      0.37161E-06    0.37161E-06
          6      0.41376E-08    0.41376E-08
          7      0.68316E-10    0.68316E-10
            7 Projection iterations (linear)

            Min Velocity: ( 0.0000E+00, -3.8529E-02, -3.1318E-02)
            Max Velocity: ( 2.9703E+00,  4.8988E-02,  4.4924E-02)

         27: t =   5.11135E-01, dt(growth) =   3.55567E-02
DS: totally/essentially/non-void cell counts = 123/3/90
DS: T(H) iterations:  1.24(avg), 4(max)
DS: T(H) salvage rate = 0.294; interval adjustments =  1.00(avg), 1(max)

DS: dt=3.556E-02, NFUN:NPC:NPA=0000081:0000027:0000054
 Linear solver name: projection
       iter         ||r||           err
          0      0.12622E+00    0.12622E+00
          1      0.34324E-01    0.34324E-01
          2      0.21843E-02    0.21843E-02
          3      0.11227E-03    0.11227E-03
          4      0.41699E-05    0.41699E-05
          5      0.83681E-07    0.83681E-07
          6      0.96443E-09    0.96443E-09
          7      0.14126E-10    0.14126E-10
            7 Projection iterations (linear)

            Min Velocity: ( 0.0000E+00, -7.0153E-02, -8.0951E-02)
            Max Velocity: ( 3.1756E+00,  8.4846E-02,  6.7323E-02)

         28: t =   5.46691E-01, dt(growth) =   3.73346E-02
DS: culled material fragments from 1 cells.
DS: totally/essentially/non-void cell counts = 126/0/90
DS: T(H) iterations:  1.24(avg), 4(max)
DS: T(H) salvage rate = 0.294; interval adjustments =  1.00(avg), 1(max)

DS: dt=3.733E-02, NFUN:NPC:NPA=0000084:0000028:0000056
 Linear solver name: projection
       iter         ||r||           err
          0      0.99960E-01    0.99960E-01
          1      0.16088E-01    0.16088E-01
          2      0.23332E-02    0.23332E-02
          3      0.11155E-03    0.11155E-03
          4      0.25745E-05    0.25745E-05
          5      0.44330E-07    0.44330E-07
          6      0.94485E-09    0.94485E-09
          7      0.95161E-11    0.95161E-11
            7 Projection iterations (linear)

            Min Velocity: ( 0.0000E+00, -3.3038E-02, -2.7623E-02)
            Max Velocity: ( 3.3895E+00,  4.2644E-02,  3.8746E-02)

         29: t =   5.84026E-01, dt(courant [48]) =   3.78217E-02
DS: culled material fragments from 2 cells.
DS: totally/essentially/non-void cell counts = 119/2/95
DS: T(H) iterations:  1.18(avg), 4(max)
DS: T(H) salvage rate = 0.274; interval adjustments =  1.00(avg), 1(max)

DS: dt=3.782E-02, NFUN:NPC:NPA=0000087:0000029:0000058
 Linear solver name: projection
       iter         ||r||           err
          0      0.19852E+01    0.19852E+01
          1      0.10009E+00    0.10009E+00
          2      0.28524E-01    0.28524E-01
          3      0.19269E-02    0.19269E-02
          4      0.36427E-04    0.36427E-04
          5      0.68858E-06    0.68858E-06
          6      0.15925E-07    0.15925E-07
          7      0.18217E-09    0.18217E-09
            7 Projection iterations (linear)

            Min Velocity: ( 0.0000E+00, -3.0167E-02, -2.9393E-02)
            Max Velocity: ( 3.5914E+00,  5.7715E-02,  4.1178E-02)

         30: t =   6.21847E-01, dt(courant [48]) =   3.36381E-02
DS: totally/essentially/non-void cell counts = 124/2/90
DS: T(H) iterations:  1.23(avg), 4(max)
DS: T(H) salvage rate = 0.281; interval adjustments =  1.00(avg), 1(max)

DS: dt=3.364E-02, NFUN:NPC:NPA=0000090:0000030:0000060
 Linear solver name: projection
       iter         ||r||           err
          0      0.29255E+00    0.29255E+00
          1      0.76956E-01    0.76956E-01
          2      0.11660E-01    0.11660E-01
          3      0.48086E-03    0.48086E-03
          4      0.11437E-04    0.11437E-04
          5      0.15189E-06    0.15189E-06
          6      0.18297E-08    0.18297E-08
          7      0.19116E-10    0.19116E-10
            7 Projection iterations (linear)

            Min Velocity: ( 0.0000E+00, -2.5824E-02, -3.6795E-02)
            Max Velocity: ( 3.7840E+00,  8.1565E-02,  4.4437E-02)

         31: t =   6.55486E-01, dt(courant [47]) =   3.21381E-02
Warning: excessive volume adjustment: cell=50, matid=1, adjustment fraction= -2.558E-05
Warning: excessive volume adjustment: cell=64, matid=1, adjustment fraction=  2.362E-14
Warning: excessive volume adjustment: cell=65, matid=1, adjustment fraction= -1.894E-13
Warning: excessive volume adjustment: cell=66, matid=1, adjustment fraction=  3.236E-13
Warning: excessive volume adjustment: cell=67, matid=1, adjustment fraction=  1.317E-08
Warning: excessive volume adjustment: cell=68, matid=1, adjustment fraction=  3.079E-13
Warning: excessive volume adjustment: cell=69, matid=1, adjustment fraction= -4.306E-13
Warning: excessive volume adjustment: cell=70, matid=1, adjustment fraction=  1.996E-13
Warning: excessive volume adjustment: cell=71, matid=1, adjustment fraction= -3.351E-13
Warning: excessive volume adjustment: cell=72, matid=1, adjustment fraction=  9.932E-14
Warning: excessive volume adjustment: cell=73, matid=1, adjustment fraction= -3.376E-14
DS: totally/essentially/non-void cell counts = 125/1/90
DS: T(H) iterations:  1.26(avg), 4(max)
DS: T(H) salvage rate = 0.292; interval adjustments =  1.00(avg), 1(max)

DS: dt=3.214E-02, NFUN:NPC:NPA=0000093:0000031:0000062
 Linear solver name: projection
       iter         ||r||           err
          0      0.15292E+00    0.15292E+00
          1      0.25357E-01    0.25357E-01
          2      0.28561E-02    0.28561E-02
          3      0.13993E-03    0.13993E-03
          4      0.50498E-05    0.50498E-05
          5      0.73109E-07    0.73109E-07
          6      0.11012E-08    0.11012E-08
          7      0.12046E-10    0.12046E-10
            7 Projection iterations (linear)

            Min Velocity: ( 0.0000E+00, -2.2061E-02, -3.7809E-02)
            Max Velocity: ( 3.9736E+00,  1.0513E-01,  4.4797E-02)

         32: t =   6.87624E-01, dt(courant [48]) =   3.21470E-02
DS: totally/essentially/non-void cell counts = 119/3/94
DS: T(H) iterations:  1.25(avg), 4(max)
DS: T(H) salvage rate = 0.273; interval adjustments =  1.00(avg), 1(max)

DS: dt=3.215E-02, NFUN:NPC:NPA=0000096:0000032:0000064
 Linear solver name: projection
       iter         ||r||           err
          0      0.38055E+00    0.38055E+00
          1      0.64683E-01    0.64683E-01
          2      0.11437E-01    0.11437E-01
          3      0.34635E-03    0.34635E-03
          4      0.74290E-05    0.74290E-05
          5      0.84736E-07    0.84736E-07
          6      0.13877E-08    0.13877E-08
          7      0.15034E-10    0.15034E-10
            7 Projection iterations (linear)

            Min Velocity: ( 0.0000E+00, -2.1600E-02, -2.4377E-02)
            Max Velocity: ( 4.1466E+00,  5.3935E-02,  5.9981E-02)

         33: t =   7.19771E-01, dt(courant [47]) =   3.06525E-02
DS: culled material fragments from 1 cells.
DS: totally/essentially/non-void cell counts = 122/4/90
DS: T(H) iterations:  1.25(avg), 4(max)
DS: T(H) salvage rate = 0.284; interval adjustments =  1.00(avg), 1(max)

DS: dt=3.065E-02, NFUN:NPC:NPA=0000099:0000033:0000066
 Linear solver name: projection
       iter         ||r||           err
          0      0.28288E+00    0.28288E+00
          1      0.42085E-01    0.42085E-01
          2      0.61081E-02    0.61081E-02
          3      0.26229E-03    0.26229E-03
          4      0.57786E-05    0.57786E-05
          5      0.83828E-07    0.83828E-07
          6      0.10392E-08    0.10392E-08
            6 Projection iterations (linear)

            Min Velocity: ( 0.0000E+00, -1.9976E-02, -2.5706E-02)
            Max Velocity: ( 4.3213E+00,  5.9529E-02,  5.5178E-02)

         34: t =   7.50423E-01, dt(courant [144]) =   2.98075E-02
DS: totally/essentially/non-void cell counts = 119/3/94
DS: T(H) iterations:  1.18(avg), 4(max)
DS: T(H) salvage rate = 0.273; interval adjustments =  1.00(avg), 1(max)

DS: dt=2.981E-02, NFUN:NPC:NPA=0000102:0000034:0000068
 Linear solver name: projection
       iter         ||r||           err
          0      0.42027E+00    0.42027E+00
          1      0.82461E-01    0.82461E-01
          2      0.94339E-02    0.94339E-02
          3      0.33824E-03    0.33824E-03
          4      0.72968E-05    0.72968E-05
          5      0.86830E-07    0.86830E-07
          6      0.13559E-08    0.13559E-08
          7      0.14540E-10    0.14540E-10
            7 Projection iterations (linear)

            Min Velocity: ( 0.0000E+00, -1.7713E-02, -4.7421E-02)
            Max Velocity: ( 4.4535E+00,  4.9564E-02,  6.7538E-02)

         35: t =   7.80231E-01, dt(courant [78]) =   2.87479E-02
DS: culled material fragments from 1 cells.
DS: totally/essentially/non-void cell counts = 117/3/96
DS: T(H) iterations:  1.17(avg), 4(max)
DS: T(H) salvage rate = 0.281; interval adjustments =  1.00(avg), 1(max)

DS: dt=2.875E-02, NFUN:NPC:NPA=0000105:0000035:0000070
 Linear solver name: projection
       iter         ||r||           err
          0      0.31242E+00    0.31242E+00
          1      0.45136E-01    0.45136E-01
          2      0.28557E-02    0.28557E-02
          3      0.18374E-03    0.18374E-03
          4      0.59696E-05    0.59696E-05
          5      0.12098E-06    0.12098E-06
          6      0.23310E-08    0.23310E-08
          7      0.26354E-10    0.26354E-10
            7 Projection iterations (linear)

            Min Velocity: ( 0.0000E+00, -2.3434E-02, -5.1616E-02)
            Max Velocity: ( 4.6106E+00,  2.2975E-02,  4.7837E-02)

         36: t =   8.08979E-01, dt(courant [78]) =   2.77762E-02
DS: totally/essentially/non-void cell counts = 121/5/90
DS: T(H) iterations:  1.22(avg), 5(max)
DS: T(H) salvage rate = 0.277; interval adjustments =  1.00(avg), 1(max)

DS: dt=2.778E-02, NFUN:NPC:NPA=0000108:0000036:0000072
 Linear solver name: projection
       iter         ||r||           err
          0      0.68895E+00    0.68895E+00
          1      0.13706E+00    0.13706E+00
          2      0.24735E-01    0.24735E-01
          3      0.65917E-03    0.65917E-03
          4      0.13179E-04    0.13179E-04
          5      0.22188E-06    0.22188E-06
          6      0.30688E-08    0.30688E-08
          7      0.29813E-10    0.29813E-10
            7 Projection iterations (linear)

            Min Velocity: ( 0.0000E+00, -9.5119E-02, -7.1626E-02)
            Max Velocity: ( 4.7637E+00,  1.6697E-02,  3.8872E-02)

         37: t =   8.36755E-01, dt(courant [72]) =   2.65851E-02
DS: totally/essentially/non-void cell counts = 116/3/97
DS: T(H) iterations:  1.15(avg), 5(max)
DS: T(H) salvage rate = 0.259; interval adjustments =  1.00(avg), 1(max)

DS: dt=2.659E-02, NFUN:NPC:NPA=0000111:0000037:0000074
 Linear solver name: projection
       iter         ||r||           err
          0      0.51762E+00    0.51762E+00
          1      0.12999E+00    0.12999E+00
          2      0.14592E-01    0.14592E-01
          3      0.51654E-03    0.51654E-03
          4      0.89589E-05    0.89589E-05
          5      0.14559E-06    0.14559E-06
          6      0.19870E-08    0.19870E-08
          7      0.23054E-10    0.23054E-10
            7 Projection iterations (linear)

            Min Velocity: ( 0.0000E+00, -4.5636E-02, -7.3678E-02)
            Max Velocity: ( 4.9105E+00,  3.7422E-02,  3.1965E-02)

         38: t =   8.63340E-01, dt(courant [169]) =   2.43088E-02
DS: culled material fragments from 1 cells.
DS: totally/essentially/non-void cell counts = 118/6/92
DS: T(H) iterations:  1.24(avg), 5(max)
DS: T(H) salvage rate = 0.261; interval adjustments =  1.00(avg), 1(max)

DS: dt=2.431E-02, NFUN:NPC:NPA=0000114:0000038:0000076
 Linear solver name: projection
       iter         ||r||           err
          0      0.81039E+00    0.81039E+00
          1      0.19755E+00    0.19755E+00
          2      0.29881E-01    0.29881E-01
          3      0.89136E-03    0.89136E-03
          4      0.15640E-04    0.15640E-04
          5      0.24746E-06    0.24746E-06
          6      0.34170E-08    0.34170E-08
          7      0.30329E-10    0.30329E-10
            7 Projection iterations (linear)

            Min Velocity: ( 0.0000E+00, -5.2184E-02, -1.1861E-01)
            Max Velocity: ( 5.0478E+00,  3.7953E-02,  5.2669E-02)

         39: t =   8.87649E-01, dt(time) =   2.32551E-02
DS: culled material fragments from 1 cells.
DS: totally/essentially/non-void cell counts = 121/4/91
DS: T(H) iterations:  1.26(avg), 5(max)
DS: T(H) salvage rate = 0.266; interval adjustments =  1.00(avg), 1(max)

DS: dt=2.326E-02, NFUN:NPC:NPA=0000117:0000039:0000078
 Linear solver name: projection
       iter         ||r||           err
          0      0.17041E+00    0.17041E+00
          1      0.10501E-01    0.10501E-01
          2      0.19201E-02    0.19201E-02
          3      0.94110E-04    0.94110E-04
          4      0.44843E-05    0.44843E-05
          5      0.85041E-07    0.85041E-07
          6      0.10579E-08    0.10579E-08
            6 Projection iterations (linear)

            Min Velocity: ( 0.0000E+00, -1.3006E-01, -1.0471E-01)
            Max Velocity: ( 5.1769E+00,  1.1498E-01,  8.2329E-02)

         40: t =   9.10904E-01, dt(time) =   2.28559E-02
DS: totally/essentially/non-void cell counts = 116/3/97
DS: T(H) iterations:  1.24(avg), 5(max)
DS: T(H) salvage rate = 0.267; interval adjustments =  1.00(avg), 1(max)

DS: dt=2.286E-02, NFUN:NPC:NPA=0000120:0000040:0000080
 Linear solver name: projection
       iter         ||r||           err
          0      0.55185E+00    0.55185E+00
          1      0.17893E-01    0.17893E-01
          2      0.51049E-02    0.51049E-02
          3      0.26733E-03    0.26733E-03
          4      0.64288E-05    0.64288E-05
          5      0.13530E-06    0.13530E-06
          6      0.19565E-08    0.19565E-08
          7      0.29938E-10    0.29938E-10
            7 Projection iterations (linear)

            Min Velocity: ( 0.0000E+00, -1.6888E-01, -9.8211E-02)
            Max Velocity: ( 5.3214E+00,  1.1319E-01,  1.0296E-01)

         41: t =   9.33760E-01, dt(time) =   2.24635E-02
DS: totally/essentially/non-void cell counts = 119/7/90
DS: T(H) iterations:  1.27(avg), 5(max)
DS: T(H) salvage rate = 0.275; interval adjustments =  1.00(avg), 1(max)

DS: dt=2.246E-02, NFUN:NPC:NPA=0000123:0000041:0000082
 Linear solver name: projection
       iter         ||r||           err
          0      0.48366E+00    0.48366E+00
          1      0.28401E-01    0.28401E-01
          2      0.59157E-02    0.59157E-02
          3      0.38791E-03    0.38791E-03
          4      0.95607E-05    0.95607E-05
          5      0.14079E-06    0.14079E-06
          6      0.23562E-08    0.23562E-08
          7      0.32749E-10    0.32749E-10
            7 Projection iterations (linear)

            Min Velocity: ( 0.0000E+00, -2.3260E-02, -2.6775E-02)
            Max Velocity: ( 5.4215E+00,  1.1100E-01,  1.5256E-01)

         42: t =   9.56223E-01, dt(time) =   2.19257E-02
DS: totally/essentially/non-void cell counts = 120/5/91
DS: T(H) iterations:  1.29(avg), 5(max)
DS: T(H) salvage rate = 0.277; interval adjustments =  1.00(avg), 1(max)

DS: dt=2.193E-02, NFUN:NPC:NPA=0000126:0000042:0000084
 Linear solver name: projection
       iter         ||r||           err
          0      0.41217E+00    0.41217E+00
          1      0.34582E-01    0.34582E-01
          2      0.23896E-02    0.23896E-02
          3      0.12165E-03    0.12165E-03
          4      0.57531E-05    0.57531E-05
          5      0.86637E-07    0.86637E-07
          6      0.13384E-08    0.13384E-08
            6 Projection iterations (linear)

            Min Velocity: ( 0.0000E+00, -1.5933E-02, -2.3922E-02)
            Max Velocity: ( 5.5494E+00,  1.0852E-01,  1.5619E-01)

         43: t =   9.78149E-01, dt(time) =   1.34515E-02
Warning: excessive volume adjustment: cell=104, adjustment fraction=  4.872E-08
Warning: excessive volume adjustment: cell=104, adjustment fraction=  2.436E-08
DS: totally/essentially/non-void cell counts = 117/2/97
DS: T(H) iterations:  1.30(avg), 5(max)
DS: T(H) salvage rate = 0.274; interval adjustments =  1.00(avg), 1(max)

DS: dt=1.345E-02, NFUN:NPC:NPA=0000129:0000043:0000086
 Linear solver name: projection
       iter         ||r||           err
          0      0.77827E+00    0.77827E+00
          1      0.16586E+00    0.16586E+00
          2      0.16217E-01    0.16217E-01
          3      0.66263E-03    0.66263E-03
          4      0.11474E-04    0.11474E-04
          5      0.21704E-06    0.21704E-06
          6      0.34129E-08    0.34129E-08
            6 Projection iterations (linear)

            Min Velocity: ( 0.0000E+00, -1.3214E-02, -1.7495E-02)
            Max Velocity: ( 5.6411E+00,  4.3765E-02,  4.1766E-02)

         44: t =   9.91600E-01, dt(time) =   8.39965E-03
Warning: excessive volume adjustment: cell=170, adjustment fraction=  8.106E-08
DS: culled material fragments from 1 cells.
DS: totally/essentially/non-void cell counts = 118/5/93
DS: T(H) iterations:  1.31(avg), 5(max)
DS: T(H) salvage rate = 0.282; interval adjustments =  1.00(avg), 1(max)

DS: dt=8.400E-03, NFUN:NPC:NPA=0000132:0000044:0000088
 Linear solver name: projection
       iter         ||r||           err
          0      0.12052E+01    0.12052E+01
          1      0.37055E-01    0.37055E-01
          2      0.99992E-02    0.99992E-02
          3      0.56091E-03    0.56091E-03
          4      0.67812E-05    0.67812E-05
          5      0.87349E-07    0.87349E-07
          6      0.22677E-08    0.22677E-08
            6 Projection iterations (linear)

            Min Velocity: ( 0.0000E+00, -1.1291E-02, -2.0017E-02)
            Max Velocity: ( 5.7035E+00,  8.3325E-02,  4.7187E-02)

================================================================================

TERMINATION

                 Final Time:  1.0000E+00 after    44 steps


TIMING SUMMARY
--------------
  1.786E+00 --- Total
    4.908E-03 --- Input
    3.969E-01 --- Initialization
      2.949E-01 --- VOF Initialize
      3.800E-04 --- FHT function
    1.381E+00 --- Main Cycle
      3.138E-03 --- Predictor
      3.358E-01 --- timer_projection
        2.363E-01 --- timer_projection_mac
          1.930E-01 --- timer_projection_solver
            7.854E-02 --- ppe-matvec
              4.021E-02 --- ppe-matvec-face-grad
              3.730E-03 --- ppe-matvec-bc
              2.434E-02 --- ppe-matvec-flux
              9.694E-03 --- ppe-matvec-div
            9.659E-02 --- Solver TMP1
          1.129E-02 --- ppe-matvec
            6.026E-03 --- ppe-matvec-face-grad
            5.170E-04 --- ppe-matvec-bc
            3.343E-03 --- ppe-matvec-flux
            1.335E-03 --- ppe-matvec-div
        2.264E-02 --- timer_projection_corrector
          2.120E-02 --- timer_projection_corrector
      1.148E-02 --- Time Step
      7.570E-01 --- Mass Advection
        7.254E-01 --- Volume Tracking
          6.981E-01 --- Reconstruct/Advect
            3.586E-01 --- Locate Plane
        2.171E-02 --- Momentum Advection
      2.454E-01 --- Diffusion Solver
        1.450E-01 --- FHT precon compute
          1.125E-02 --- hypre-matrix-copy
          1.091E-02 --- boomer-setup
        3.801E-02 --- FHT function
        1.776E-02 --- FHT precon apply
          6.955E-03 --- boomer-solve

                  Process virtual memory used: 2.50E+02 mB
                                   words/cell: 151708

truchas terminated normally on 19 May 20 at 22:11:58
